,abstract,faithfulness,precision_recall,semantic_similarity,pdf,pdf-faithfulness,pdf-precision_recall,pdf-semantic_similarity,precision,recall,pdf-precision,pdf-recall
Solution of the matrix equation AX+,,,,,,,,,,,,
A global solution for the structured total least squares problem with block circulant matrices,crossref,0.0,,0.7019992385653937,,,,,1.0,0.0,,
Constrained Optim. and Lagrange Multiplier Methods,,,,,,,,,,,,
Distributed optimization and statistical learning via the alternating direction method of multipliers,crossref,0.0,,0.7101505988901994,,,,,0.0,0.0,,
A singular value thresholding algorithm for matrix completion,arxiv Library,1.0,,0.6525591669107211,arxiv Library,0.0,,0.6570472255426932,1.0,0.0,1.0,0.0
Enhancing sparsity by reweighted l1 minimization,arxiv Library,1.0,,0.796939659472224,arxiv Library,0.7,,0.8850877147294329,0.375,0.10256410256410256,0.34375,0.22
Rank-sparsity incoherence for matrix decomposition,crossref,0.0,,0.6688658908777474,,,,,0.0,0.0,,
Low-rank structure learning via log-sum heuristic recovery,,,,,,,,,,,,
Robust solutions to leastsquares problems with uncertain data,,,,,,,,,,,,
A rank minimization heuristic with application to minimum order system approximation,crossref,0.0,,0.6779008525561071,,,,,0.0,0.0,,
An analysis of the total least squares problem,,,,,,,,,,,,
Weighted `1 minimization for sparse recovery with prior information,,,,,,,,,,,,
The augmented Lagrange multiplier method for exact recovery of corrupted low-rank matrices,,,,,,,,,,,,
Robust recovery of subspace structures by low-rank representation,crossref,0.0,,0.6749936980141219,,,,,0.0,0.0,,
Software for weighted structured low-rank approximation,crossref,0.0,,0.7019992385653937,,,,,1.0,0.0,,
Overview of total least-squares methods,crossref,0.0,,0.7019992385653937,,,,,1.0,0.0,,
Application of structured total least squares for system identification and model reduction,crossref,0.0,,0.689847359043741,,,,,0.0,0.0,,
Reweighted nuclear norm minimization with application to system identification,crossref,0.0,,0.7019992385653937,,,,,1.0,0.0,,
Noisy signal recovery via iterative reweighted l1-minimization,crossref,0.0,,0.6998944433643485,,,,,0.0,0.0,,
Guaranteed minimum-rank solutions of linear matrix equations via nuclear norm minimization,crossref,0.0,,0.6704493461840146,,,,,0.0,0.0,,
"Coupling among growth rate response, metabolic cycle, and cell division cycle in yeast",crossref,1.0,,0.6706015453140397,,,,,1.0,0.0,,
Metabolic cycling without cell division cycling in respiring yeast,crossref,0.0,,0.8312966809834806,,,,,0.3695652173913043,0.18085106382978725,,
A conserved cell growth cycle can account for the environmental stress responses of divergent eukaryotes,crossref,0.5,,0.6665778794958537,,,,,1.0,0.0,,
Weighted low-rank approximations,,,,,,,,,,,,
"SDPT3 – a Matlab software package for semidefinite programming, version 1.3",,,,,,,,,,,,
Weighted and structured sparse total least-squares for perturbed compressive sampling,crossref,0.0,,0.6906949075846441,,,,,0.0,0.0,,
